{"format_version":"0.1","run_id":"futurediff-001","agent":"example-agent","agent_version":"0.0","task_id":"auth-upgrade","mode":"futurediff","started_at":"2026-07-27T00:01:00Z","finished_at":"2026-07-27T00:01:13Z","input_tokens":1080,"output_tokens":540,"model_calls":4,"tool_calls":10,"repair_turns":0,"verification_ms":3500,"compute_ms":11000,"released_effects":0,"unsafe_effects":0,"duplicate_effects":0,"success":false}
